"Map/World Grid/Crystal Mine/Crystal Danger Sign/Canvas/Dialogue BG Font","","","enableWordWrapping:1;extraPadding:0;family:PixelUnicodeFill;fontSize:1;lineSpacing:-66;overflowMode:Overflow;wordSpacing:5.6;",
"Map/World Grid/Crystal Mine/Crystal Miner/Canvas/Dialogue","","","enableWordWrapping:1;extraPadding:0;family:TinyUnicode SDF;fontSize:1;lineSpacing:-45;overflowMode:Overflow;wordSpacing:-10;",
"Map/World Grid/Crystal Mine/Crystal Miner/Canvas/Dialogue BG Font","","","enableWordWrapping:1;extraPadding:0;family:PixelUnicodeFill;fontSize:1;lineSpacing:-66;overflowMode:Overflow;wordSpacing:5.6;",
"Map/World Grid/Elevator Area/Bottom Elevator Man/Canvas/Dialogue","","","enableWordWrapping:1;extraPadding:0;family:TinyUnicode SDF;fontSize:1;lineSpacing:-45;overflowMode:Overflow;wordSpacing:-10;",
"Map/World Grid/Elevator Area/Bottom Elevator Man/Canvas/Dialogue BG Font","","","enableWordWrapping:1;extraPadding:0;family:PixelUnicodeFill;fontSize:1;lineSpacing:-66;overflowMode:Overflow;wordSpacing:5.6;",
"Map/World Grid/Objects/Hot Lava Sign/Canvas/Dialogue","","","enableWordWrapping:1;extraPadding:0;family:TinyUnicode SDF;fontSize:1;lineSpacing:-45;overflowMode:Overflow;wordSpacing:-10;",
"Map/World Grid/Objects/Hot Lava Sign/Canvas/Dialogue BG Font","","","enableWordWrapping:1;extraPadding:0;family:PixelUnicodeFill;fontSize:1;lineSpacing:-66;overflowMode:Overflow;wordSpacing:5.6;",
"Map/World Grid/Objects/Jimbobby/Canvas/Dialogue","","","enableWordWrapping:1;extraPadding:0;family:TinyUnicode SDF;fontSize:1;lineSpacing:-45;overflowMode:Overflow;wordSpacing:-10;",
"Map/World Grid/Objects/Jimbobby/Canvas/Dialogue BG Font","","","enableWordWrapping:1;extraPadding:0;family:PixelUnicodeFill;fontSize:1;lineSpacing:-66;overflowMode:Overflow;wordSpacing:5.6;",
"Map/World Grid/West Side/Burt the Craftsman/Canvas/Dialogue","","","enableWordWrapping:1;extraPadding:0;family:TinyUnicode SDF;fontSize:1;lineSpacing:-45;overflowMode:Overflow;wordSpacing:-10;",
"Map/World Grid/West Side/Burt the Craftsman/Canvas/Dialogue BG Font","","","enableWordWrapping:1;extraPadding:0;family:PixelUnicodeFill;fontSize:1;lineSpacing:-66;overflowMode:Overflow;wordSpacing:5.6;",
