"Localization files are formatted like CSV so they can be easily edited,
however formatting has strict rules for easy parsing. Most of these rules
are already handled by Excel / Libre / etc., so you don't have to worry
about them in normal usage. However, if your localization file seems to
be corrupted, these rules may be helpful for debugging purposes...
- In general, any consecutive string of \r and \n (in any order) will be
  treated as one SINGLE line break, except within an enclosed context
- The first 4 rows can be arbitrarily long
  - The first cell of first row is used to store this block of instruction
    text
  - The first 3 cells of the fourth row is used as headers
  - All other cells in the first and fourth rows are ignored
  - Columns in the second row alternate between property and value (ex.
    ' foo | 1 | bar | 3.5 | ... '
    - Any whitespaces before and after the property name are ignored
  - Columns in the third row are exclusively comments for properties in the
    second row
- Every following line can include any number of cells, but only the
  first three will be parsed (you can use the rest as comments if needed)
- The file must end in a sequence of \r and \n's
- Every cell containing a ^, \r, or \n must be enclosed in ""
  - If a "" is encountered right after a non-enclosed separator, \r, or \n,
    then the parser is said to enter an ""enclosed context"", such context
    ends immediately when a non-escaped "" that is not followed by \r, \n,
    or a separator is encountered
  - "" within each cell should be escaped using another "" in front of it,
  - If a "" is encountered in a non-enclosed context, and it is not right
    after a separator, \r, or \n, then it is entirely ignored
  - If a non-escaped "" is encountered in an enclosed context...
    - If it is followed by a separator, \r, or \n, then it is considered
      the closing quote of the current context
    - Otherwise, it is ignored
  - If a separator, \r, or \n is encountered while in an enclosed context,
    it will be preserved
",
"IsValid"," ","NonDialogueFontScale"," ","DialogueFontScale"," ",
"Set to 1 allow the parser to read this file, otherwise it will be skipped and the default English localization will be used as fallback"," ","Float value that scales font size of all dialogue text, this is an option separate because the English font of this game is *really* tiny, like about 1/3 of regular font when under the same font size."," ","Float value that scales font size of all dialogue text, this is an option separate because the English font of this game is *really* tiny, like about 1/3 of regular font when under the same font size. Recommended setting is around 0.3~0.6."," ",
"Path","Orig","Translation",
"ArtifactCanvas/ArtifactFrame/ScreenMask/InventoryPanel/Items/ArtifactInventoryItem (12)/Sunglasses Total Text","2","_ho_2_ho_",
"ArtifactCanvas/ArtifactFrame/ScreenMask/InventoryPanel/Items/ArtifactInventoryItem Breadge/Breadge Total Text","9","_ho_9_ho_",
"ArtifactCanvas/ArtifactFrame/ScreenMask/InventoryPanel/Items/ArtifactInventoryItem Oil/Oil Total Text","4","_ho_4_ho_",
"ArtifactCanvas/ArtifactFrame/ScreenMask/InventoryPanel/Text/ItemNameText","Collection","_ho_Collection_ho_",
"ArtifactCanvas/ArtifactFrame/ScreenMask/WorldMapPanel/Text/AreaNameText","Map
","_ho_Map
_ho_",
"ArtifactCanvas/ArtifactFrame/ScreenMask/WorldMapPanel/Text/AreaNameTextBG","Map
","_ho_Map
_ho_",
"Magitech Hints@0","Hold <AltViewHold> to view the past","_ho_Hold <AltViewHold> to view the past_ho_",
"Map/EightPuzzle/MagitechSTile (1) Past/Objects/Portal Operator 1@0:0","Hey what are you- wait, you're the person with all the magical artifacts!","_ho_Hey what are you- wait, you're the person with all the magical artifacts!_ho_",
"Map/EightPuzzle/MagitechSTile (1) Past/Objects/Portal Operator 1@0:1","Perfect! You have that <#2e44f0>Anchor</color>, right? I've been writing my thesis on how it affects time and space!","_ho_Perfect! You have that <#2e44f0>Anchor</color>, right? I've been writing my thesis on how it affects time and space!_ho_",
"Map/EightPuzzle/MagitechSTile (1) Past/Objects/Portal Operator 1@1:0","This... this is it! A <#c060c0><wavy>desync</wavy></color>!","_ho_This... this is it! A <#c060c0><wavy>desync</wavy></color>!_ho_",
"Map/EightPuzzle/MagitechSTile (1) Past/Objects/Portal Operator 1@2:0","These <#c060c0><wavy>desyncs</wavy></color> are so fascinating, they break all rules we know.","_ho_These <#c060c0><wavy>desyncs</wavy></color> are so fascinating, they break all rules we know._ho_",
"Map/EightPuzzle/MagitechSTile (1)/Objects/Portal Operator 2@0:0","They're just letting anyone in these days, huh?","_ho_They're just letting anyone in these days, huh?_ho_",
"Map/EightPuzzle/MagitechSTile (1)/Objects/Portal Operator 2@0:1","We found some extremely long-chinned man in the past, but he's clearly from the modern age.","_ho_We found some extremely long-chinned man in the past, but he's clearly from the modern age._ho_",
"Map/EightPuzzle/MagitechSTile (1)/Objects/Portal Operator 2@1:0","All this past and present is so confusing.","_ho_All this past and present is so confusing._ho_",
"Map/EightPuzzle/MagitechSTile (1)/Objects/Portal Operator 2@1:1","Moving objects locally doesn't matter... only the complete removal of them.","_ho_Moving objects locally doesn't matter... only the complete removal of them._ho_",
"Map/EightPuzzle/MagitechSTile (2) Past/Objects/Explosives Man@0:0","Destroy the rocks? Rig up explosives and use the laser!","_ho_Destroy the rocks? Rig up explosives and use the laser!_ho_",
"Map/EightPuzzle/MagitechSTile (2) Past/Objects/Explosives Man@0:1","Watch 'em go kaBOOM!","_ho_Watch 'em go kaBOOM!_ho_",
"Map/EightPuzzle/MagitechSTile (2) Past/Objects/Explosives Man@1:0","Erm...","_ho_Erm..._ho_",
"Map/EightPuzzle/MagitechSTile (2) Past/Objects/Explosives Man@1:1","Hope the next one's better...","_ho_Hope the next one's better..._ho_",
"Map/EightPuzzle/MagitechSTile (2) Past/Objects/Explosives Man@2:0","There're some real funny fellas 'round here, huh.","_ho_There're some real funny fellas 'round here, huh._ho_",
"Map/EightPuzzle/MagitechSTile (2) Past/Objects/Explosives Man@2:1","Think any of 'em know explosion magic?","_ho_Think any of 'em know explosion magic?_ho_",
"Map/EightPuzzle/MagitechSTile (2) Past/Objects/NPC Bomb Sign@0:1"," ...","_ho_ ..._ho_",
"Map/EightPuzzle/MagitechSTile (2) Past/Objects/NPC Bomb Sign@1:0","Oh, you're wondering why it didn't explode?","_ho_Oh, you're wondering why it didn't explode?_ho_",
"Map/EightPuzzle/MagitechSTile (2) Past/Objects/NPC Bomb Sign@1:1","I've been preparing this just for you.","_ho_I've been preparing this just for you._ho_",
"Map/EightPuzzle/MagitechSTile (2) Past/Objects/NPC Bomb Sign@1:2","Check it!","_ho_Check it!_ho_",
"Map/EightPuzzle/MagitechSTile (2) Past/Objects/NPC Bomb Sign@2:0","That was cool!! Right?!","_ho_That was cool!! Right?!_ho_",
"Map/EightPuzzle/MagitechSTile (2) Past/Objects/NPC Bomb Sign@2:1","Right..?","_ho_Right..?_ho_",
"Map/EightPuzzle/MagitechSTile (2)/Objects/Laser Operator@0:0","Our super-laser packs quite a punch! We're running some tests on it's power.","_ho_Our super-laser packs quite a punch! We're running some tests on it's power._ho_",
"Map/EightPuzzle/MagitechSTile (2)/Objects/Laser Operator@0:1","Can you get me some oil so I can verify it's impact?","_ho_Can you get me some oil so I can verify it's impact?_ho_",
"Map/EightPuzzle/MagitechSTile (2)/Objects/Laser Operator@1:0","Wow! Lasers are so cool!!","_ho_Wow! Lasers are so cool!!_ho_",
"Map/EightPuzzle/MagitechSTile (3) Past/Objects/NPC Bomb Sign@0:0","Haha don't worry, this time I'm going all out!","_ho_Haha don't worry, this time I'm going all out!_ho_",
"Map/EightPuzzle/MagitechSTile (3) Past/Objects/NPC Bomb Sign@1:0","Ready?","_ho_Ready?_ho_",
"Map/EightPuzzle/MagitechSTile (3) Past/Objects/NPC Bomb Sign@1:1","Boom.","_ho_Boom._ho_",
"Map/EightPuzzle/MagitechSTile (3) Past/Objects/NPC Bomb Sign@2:0","What? You want more?","_ho_What? You want more?_ho_",
"Map/EightPuzzle/MagitechSTile (3) Past/Objects/NPC Bomb Sign@2:1","For Todd.","_ho_For Todd._ho_",
"Map/EightPuzzle/MagitechSTile (3) Past/Objects/NPC Bomb Sign@2:2","Well... let's just say I got plans I can NOT share right now.","_ho_Well... let's just say I got plans I can NOT share right now._ho_",
"Map/EightPuzzle/MagitechSTile (3) Past/Objects/WizardDuelPuzzle/Fire Wizard Past@0:0","This <wavy>idiot</wavy> insinuated I was too short to be a wizard!","_ho_This <wavy>idiot</wavy> insinuated I was too short to be a wizard!_ho_",
"Map/EightPuzzle/MagitechSTile (3) Past/Objects/WizardDuelPuzzle/Fire Wizard Past@0:1","A DUEL will settle this finely.","_ho_A DUEL will settle this finely._ho_",
"Map/EightPuzzle/MagitechSTile (3) Past/Objects/WizardDuelPuzzle/Fire Wizard Past@0:2","Hand me that Shield Generator, and his spells will be null against me.","_ho_Hand me that Shield Generator, and his spells will be null against me._ho_",
"Map/EightPuzzle/MagitechSTile (3) Past/Objects/WizardDuelPuzzle/Fire Wizard Past@0:3","He'll stand no chance! Hahaha!","_ho_He'll stand no chance! Hahaha!_ho_",
"Map/EightPuzzle/MagitechSTile (3) Past/Objects/WizardDuelPuzzle/Fire Wizard Past@1:0","Drat... I'm back on his level.","_ho_Drat... I'm back on his level._ho_",
"Map/EightPuzzle/MagitechSTile (3) Past/Objects/WizardDuelPuzzle/Fire Wizard Past@1:1","Get me back my Shield! I can regain the advantage then.","_ho_Get me back my Shield! I can regain the advantage then._ho_",
"Map/EightPuzzle/MagitechSTile (3) Past/Objects/WizardDuelPuzzle/Fire Wizard Past@2:0","aHA! Who's too short now?","_ho_aHA! Who's too short now?_ho_",
"Map/EightPuzzle/MagitechSTile (3) Past/Objects/WizardDuelPuzzle/Fire Wizard Past@2:1","You stand no chance against this fireball!","_ho_You stand no chance against this fireball!_ho_",
"Map/EightPuzzle/MagitechSTile (3) Past/Objects/WizardDuelPuzzle/Fire Wizard Past@3:0","Now we're on even footing! And it seems we've reached an stalemate...","_ho_Now we're on even footing! And it seems we've reached an stalemate..._ho_",
"Map/EightPuzzle/MagitechSTile (3) Past/Objects/WizardDuelPuzzle/Fire Wizard Past@3:1","What say we call it a truce.","_ho_What say we call it a truce._ho_",
"Map/EightPuzzle/MagitechSTile (3) Past/Objects/WizardDuelPuzzle/Fire Wizard Past@3:2","Perhaps fire and lightning aren't so different after all.","_ho_Perhaps fire and lightning aren't so different after all._ho_",
"Map/EightPuzzle/MagitechSTile (3) Past/Objects/WizardDuelPuzzle/Fire Wizard Past@4:0","These kerfuffles are truly brash aren't they?","_ho_These kerfuffles are truly brash aren't they?_ho_",
"Map/EightPuzzle/MagitechSTile (3) Past/Objects/WizardDuelPuzzle/Fire Wizard Past@4:1","I propose we team up! Knowledge is the true sign of class. ","_ho_I propose we team up! Knowledge is the true sign of class. _ho_",
"Map/EightPuzzle/MagitechSTile (3) Past/Objects/WizardDuelPuzzle/Fire Wizard Past@5:0","These kerfuffles are truly brash aren't they?","_ho_These kerfuffles are truly brash aren't they?_ho_",
"Map/EightPuzzle/MagitechSTile (3) Past/Objects/WizardDuelPuzzle/Fire Wizard Past@5:1","Knowledge is the true sign of class. Let us team up!","_ho_Knowledge is the true sign of class. Let us team up!_ho_",
"Map/EightPuzzle/MagitechSTile (3) Past/Objects/WizardDuelPuzzle/Fire Wizard Past@6:0","These kerfuffles are truly brash aren't they?","_ho_These kerfuffles are truly brash aren't they?_ho_",
"Map/EightPuzzle/MagitechSTile (3) Past/Objects/WizardDuelPuzzle/Fire Wizard Past@6:1","Knowledge is the true sign of class. Let us team up!","_ho_Knowledge is the true sign of class. Let us team up!_ho_",
"Map/EightPuzzle/MagitechSTile (3) Past/Objects/WizardDuelPuzzle/Lightning Wizard Past@0:0","I just said what that girl at the bar said.","_ho_I just said what that girl at the bar said._ho_",
"Map/EightPuzzle/MagitechSTile (3) Past/Objects/WizardDuelPuzzle/Lightning Wizard Past@1:0","Uh oh, lil bro is upset.","_ho_Uh oh, lil bro is upset._ho_",
"Map/EightPuzzle/MagitechSTile (3) Past/Objects/WizardDuelPuzzle/Lightning Wizard Past@1:1","I'm not gonna win this fight if he has the Shield Generator.","_ho_I'm not gonna win this fight if he has the Shield Generator._ho_",
"Map/EightPuzzle/MagitechSTile (3) Past/Objects/WizardDuelPuzzle/Lightning Wizard Past@2:0","Woah, I'm toast without protection.","_ho_Woah, I'm toast without protection._ho_",
"Map/EightPuzzle/MagitechSTile (3) Past/Objects/WizardDuelPuzzle/Lightning Wizard Past@2:1","Is it getting hot in here or is that just me?","_ho_Is it getting hot in here or is that just me?_ho_",
"Map/EightPuzzle/MagitechSTile (3) Past/Objects/WizardDuelPuzzle/Lightning Wizard Past@3:0","Ha! You can't get me anymore!","_ho_Ha! You can't get me anymore!_ho_",
"Map/EightPuzzle/MagitechSTile (3) Past/Objects/WizardDuelPuzzle/Lightning Wizard Past@3:1","Now perish before my lightning spell!","_ho_Now perish before my lightning spell!_ho_",
"Map/EightPuzzle/MagitechSTile (3) Past/Objects/WizardDuelPuzzle/Lightning Wizard Past@4:0","Damn you! Now I'll never win this battle. Perhaps the time has come for a new approach.","_ho_Damn you! Now I'll never win this battle. Perhaps the time has come for a new approach._ho_",
"Map/EightPuzzle/MagitechSTile (3) Past/Objects/WizardDuelPuzzle/Lightning Wizard Past@4:1","A truce it is!","_ho_A truce it is!_ho_",
"Map/EightPuzzle/MagitechSTile (3) Past/Objects/WizardDuelPuzzle/Lightning Wizard Past@4:2","Now that you say it, our combined powers would be unstoppable!","_ho_Now that you say it, our combined powers would be unstoppable!_ho_",
"Map/EightPuzzle/MagitechSTile (3) Past/Objects/WizardDuelPuzzle/Lightning Wizard Past@5:0","Fret not my new friend. With our efforts combined, we will pave the way for fire and lightning.","_ho_Fret not my new friend. With our efforts combined, we will pave the way for fire and lightning._ho_",
"Map/EightPuzzle/MagitechSTile (3) Past/Objects/WizardDuelPuzzle/Lightning Wizard Past@6:0","Fret not my new friend. With our efforts combined, we will pave the way for fire and lightning.","_ho_Fret not my new friend. With our efforts combined, we will pave the way for fire and lightning._ho_",
"Map/EightPuzzle/MagitechSTile (3) Past/Objects/WizardDuelPuzzle/Lightning Wizard Past@7:0","Fret not my new friend. With our efforts combined, we will pave the way for fire and lightning.","_ho_Fret not my new friend. With our efforts combined, we will pave the way for fire and lightning._ho_",
"Map/EightPuzzle/MagitechSTile (3)/All Tile Maps/House Tile Maps/Decorations/Curator@0:0","Two wizards once had a legendary duel here during the height of the wizarding era.","_ho_Two wizards once had a legendary duel here during the height of the wizarding era._ho_",
"Map/EightPuzzle/MagitechSTile (3)/All Tile Maps/House Tile Maps/Decorations/Curator@0:1","Unfortunately they killed each other during the fight.","_ho_Unfortunately they killed each other during the fight._ho_",
"Map/EightPuzzle/MagitechSTile (3)/All Tile Maps/House Tile Maps/Decorations/Curator@0:2","Imagine what they could have done together, with the power of friendship!","_ho_Imagine what they could have done together, with the power of friendship!_ho_",
"Map/EightPuzzle/MagitechSTile (3)/All Tile Maps/House Tile Maps/Decorations/Curator@0:3","This Shield Generator is a relic from that duel.","_ho_This Shield Generator is a relic from that duel._ho_",
"Map/EightPuzzle/MagitechSTile (3)/All Tile Maps/House Tile Maps/Decorations/Curator@0:4","And here is where I would have room for something like a gem... if I had one.","_ho_And here is where I would have room for something like a gem... if I had one._ho_",
"Map/EightPuzzle/MagitechSTile (3)/All Tile Maps/House Tile Maps/Decorations/Curator@1:0","And here is where I would have room for something like a gem... if I had one.","_ho_And here is where I would have room for something like a gem... if I had one._ho_",
"Map/EightPuzzle/MagitechSTile (3)/All Tile Maps/House Tile Maps/Decorations/Curator@1:1","That would be so terrible if I had a gem. I only have one rope.","_ho_That would be so terrible if I had a gem. I only have one rope._ho_",
"Map/EightPuzzle/MagitechSTile (3)/All Tile Maps/House Tile Maps/Decorations/Curator@1:2","Man it would really suck if I had a gem. The absoute worst.","_ho_Man it would really suck if I had a gem. The absoute worst._ho_",
"Map/EightPuzzle/MagitechSTile (3)/All Tile Maps/House Tile Maps/Decorations/Curator@2:0","Behold! The Fire gem. (Don't touch it.)","_ho_Behold! The Fire gem. (Don't touch it.)_ho_",
"Map/EightPuzzle/MagitechSTile (3)/All Tile Maps/House Tile Maps/Decorations/Curator@2:1","It was created by the short wizard after he won the duel!","_ho_It was created by the short wizard after he won the duel!_ho_",
"Map/EightPuzzle/MagitechSTile (3)/All Tile Maps/House Tile Maps/Decorations/Curator@2:2","I will say, I don't know what I would do if the gem were any bigger or more powerful.","_ho_I will say, I don't know what I would do if the gem were any bigger or more powerful._ho_",
"Map/EightPuzzle/MagitechSTile (3)/All Tile Maps/House Tile Maps/Decorations/Curator@2:3","It would really suck cause I wouldn't be able to fit it that would be terrible.","_ho_It would really suck cause I wouldn't be able to fit it that would be terrible._ho_",
"Map/EightPuzzle/MagitechSTile (3)/All Tile Maps/House Tile Maps/Decorations/Curator@3:0","Behold! The Lightning gem. (Don't touch it)","_ho_Behold! The Lightning gem. (Don't touch it)_ho_",
"Map/EightPuzzle/MagitechSTile (3)/All Tile Maps/House Tile Maps/Decorations/Curator@3:1","It was created by the lightning wizard after he won the duel!","_ho_It was created by the lightning wizard after he won the duel!_ho_",
"Map/EightPuzzle/MagitechSTile (3)/All Tile Maps/House Tile Maps/Decorations/Curator@3:2","I will say, I don't know what I would do if the gem were any bigger or more powerful.","_ho_I will say, I don't know what I would do if the gem were any bigger or more powerful._ho_",
"Map/EightPuzzle/MagitechSTile (3)/All Tile Maps/House Tile Maps/Decorations/Curator@3:3","It would really suck cause I wouldn't be able to fit it that would be terrible.","_ho_It would really suck cause I wouldn't be able to fit it that would be terrible._ho_",
"Map/EightPuzzle/MagitechSTile (3)/All Tile Maps/House Tile Maps/Decorations/Curator@4:0","Tall and small, joining powers! Who would have thought?","_ho_Tall and small, joining powers! Who would have thought?_ho_",
"Map/EightPuzzle/MagitechSTile (3)/All Tile Maps/House Tile Maps/Decorations/Curator@4:1","In fact, the gem the made is so big I can't even rope it off!","_ho_In fact, the gem the made is so big I can't even rope it off!_ho_",
"Map/EightPuzzle/MagitechSTile (3)/All Tile Maps/House Tile Maps/Decorations/Curator@4:2","Anyways, it's brought in more visitors. Take this as thanks.","_ho_Anyways, it's brought in more visitors. Take this as thanks._ho_",
"Map/EightPuzzle/MagitechSTile (3)/All Tile Maps/House Tile Maps/Decorations/Curator@5:0","Tall and small, joining powers! Who would have thought?","_ho_Tall and small, joining powers! Who would have thought?_ho_",
"Map/EightPuzzle/MagitechSTile (3)/All Tile Maps/House Tile Maps/Decorations/Curator@5:1","In fact, the gem the made is so big I can't even rope it off!","_ho_In fact, the gem the made is so big I can't even rope it off!_ho_",
"Map/EightPuzzle/MagitechSTile (3)/All Tile Maps/House Tile Maps/Decorations/Curator@5:2","Anyways, it's brought in more visitors. Take this as thanks.","_ho_Anyways, it's brought in more visitors. Take this as thanks._ho_",
"Map/EightPuzzle/MagitechSTile (3)/All Tile Maps/House Tile Maps/Decorations/Curator@6:0","Business is booming.","_ho_Business is booming._ho_",
"Map/EightPuzzle/MagitechSTile (3)/All Tile Maps/House Tile Maps/Decorations/Curator@7:0","Hey, where'd the gem go?","_ho_Hey, where'd the gem go?_ho_",
"Map/EightPuzzle/MagitechSTile (3)/All Tile Maps/House Tile Maps/Decorations/Curator@7:1","I knew I should've bought insurance.","_ho_I knew I should've bought insurance._ho_",
"Map/EightPuzzle/MagitechSTile (4) Past/Objects/Burger Puzzle/Hungry Ol Chap@0:0","What have I done to deserve this? Is there no justice in this cruel and uncaring world?","_ho_What have I done to deserve this? Is there no justice in this cruel and uncaring world?_ho_",
"Map/EightPuzzle/MagitechSTile (4) Past/Objects/Burger Puzzle/Hungry Ol Chap@1:0","Hear thee, hear thee! I introduce to you... the Burger! Allow me to show you its juicy deliciousness!","_ho_Hear thee, hear thee! I introduce to you... the Burger! Allow me to show you its juicy deliciousness!_ho_",
"Map/EightPuzzle/MagitechSTile (4) Past/Objects/Burger Puzzle/Hungry Ol Chap@2:0","Wait, where are you going with that? Oh my days, someone help me!","_ho_Wait, where are you going with that? Oh my days, someone help me!_ho_",
"Map/EightPuzzle/MagitechSTile (4) Past/Objects/Burger Puzzle/Hungry Ol Chap@3:0","Wait, that's not my burger. Where did you get that?","_ho_Wait, that's not my burger. Where did you get that?_ho_",
"Map/EightPuzzle/MagitechSTile (4) Past/Objects/Shrooms Puzzle/Anti-Shroom Wizard@0:0","My castle has gone missing! Good heavens what sorcery is this?","_ho_My castle has gone missing! Good heavens what sorcery is this?_ho_",
"Map/EightPuzzle/MagitechSTile (4) Past/Objects/Shrooms Puzzle/Anti-Shroom Wizard@0:1","Ahhh! Where did all those mushrooms come from? Did I botch the spell that badly?","_ho_Ahhh! Where did all those mushrooms come from? Did I botch the spell that badly?_ho_",
"Map/EightPuzzle/MagitechSTile (4) Past/Objects/Shrooms Puzzle/Anti-Shroom Wizard@0:2","Broken bridge, dissapearing castle, mushrooms everywhere, oh is there no end to this madness?","_ho_Broken bridge, dissapearing castle, mushrooms everywhere, oh is there no end to this madness?_ho_",
"Map/EightPuzzle/MagitechSTile (4) Past/Objects/Shrooms Puzzle/Anti-Shroom Wizard@1:0","I sense something. Is that.. the castle? Could it be?","_ho_I sense something. Is that.. the castle? Could it be?_ho_",
"Map/EightPuzzle/MagitechSTile (4) Past/Objects/Shrooms Puzzle/Anti-Shroom Wizard@1:1","But these stupid fungi are still in my way. ","_ho_But these stupid fungi are still in my way. _ho_",
"Map/EightPuzzle/MagitechSTile (4) Past/Objects/Shrooms Puzzle/Anti-Shroom Wizard@2:0","Aha! I knew my castle was nearby","_ho_Aha! I knew my castle was nearby_ho_",
"Map/EightPuzzle/MagitechSTile (4) Past/Objects/Shrooms Puzzle/Anti-Shroom Wizard@2:1","But I can't fix the bridge. There's still... mushrooms in the way","_ho_But I can't fix the bridge. There's still... mushrooms in the way_ho_",
"Map/EightPuzzle/MagitechSTile (4) Past/Objects/Shrooms Puzzle/Anti-Shroom Wizard@2:2","It's like they're... sucking away my power. What foul and heinous creations!","_ho_It's like they're... sucking away my power. What foul and heinous creations!_ho_",
"Map/EightPuzzle/MagitechSTile (4) Past/Objects/Shrooms Puzzle/Anti-Shroom Wizard@3:0","They're gone! Gone at last!","_ho_They're gone! Gone at last!_ho_",
"Map/EightPuzzle/MagitechSTile (4) Past/Objects/Shrooms Puzzle/Anti-Shroom Wizard@3:1","But... my castle. Oh where has my castle gone?","_ho_But... my castle. Oh where has my castle gone?_ho_",
"Map/EightPuzzle/MagitechSTile (4) Past/Objects/Shrooms Puzzle/Anti-Shroom Wizard@4:0","My castle! My beautiful, mushroomless castle!","_ho_My castle! My beautiful, mushroomless castle!_ho_",
"Map/EightPuzzle/MagitechSTile (4) Past/Objects/Shrooms Puzzle/Anti-Shroom Wizard@4:1","Oh what a wonderful day this is! My power has returned at last!","_ho_Oh what a wonderful day this is! My power has returned at last!_ho_",
"Map/EightPuzzle/MagitechSTile (4) Past/Objects/Shrooms Puzzle/Anti-Shroom Wizard@4:2","One bridge made, coated with anti-shroomness...one less black market for me.","_ho_One bridge made, coated with anti-shroomness...one less black market for me._ho_",
"Map/EightPuzzle/MagitechSTile (4) Past/Objects/Shrooms Puzzle/Anti-Shroom Wizard@5:0","Who lived in that castle again?","_ho_Who lived in that castle again?_ho_",
"Map/EightPuzzle/MagitechSTile (4)/Objects/Burger Puzzle/Hungry Worker@0:0","I would kill for a second burger right now. The cafeteria lady is so stingy!","_ho_I would kill for a second burger right now. The cafeteria lady is so stingy!_ho_",
"Map/EightPuzzle/MagitechSTile (4)/Objects/Burger Puzzle/Hungry Worker@0:1","Speaking of, I heard the first burger was created and eaten at this very spot!","_ho_Speaking of, I heard the first burger was created and eaten at this very spot!_ho_",
"Map/EightPuzzle/MagitechSTile (4)/Objects/Burger Puzzle/Hungry Worker@1:0","Wait... what happened to my burger?","_ho_Wait... what happened to my burger?_ho_",
"Map/EightPuzzle/MagitechSTile (4)/Objects/Burger Puzzle/Hungry Worker@2:0","Oh my delicousness, I will never let you go again!","_ho_Oh my delicousness, I will never let you go again!_ho_",
"Map/EightPuzzle/MagitechSTile (4)/Objects/Burger Puzzle/Hungry Worker@3:0","It seems as though this is some sort of... magical burger. It looks a little old, but it will do.","_ho_It seems as though this is some sort of... magical burger. It looks a little old, but it will do._ho_",
"Map/EightPuzzle/MagitechSTile (4)/Objects/Burger Puzzle/Hungry Worker@3:1","But even a magic burger is just a burger. What I would do for a second burger, magical or not...","_ho_But even a magic burger is just a burger. What I would do for a second burger, magical or not..._ho_",
"Map/EightPuzzle/MagitechSTile (4)/Objects/Burger Puzzle/Hungry Worker@4:0","Hey! Where are you taking my burger!","_ho_Hey! Where are you taking my burger!_ho_",
"Map/EightPuzzle/MagitechSTile (4)/Objects/Burger Puzzle/Hungry Worker@5:0","Is that burger... glowing?","_ho_Is that burger... glowing?_ho_",
