"Localization files are formatted like CSV so they can be easily edited,
however formatting has strict rules for easy parsing. Most of these rules
are already handled by Excel / Libre / etc., so you don't have to worry
about them in normal usage. However, if your localization file seems to
be corrupted, these rules may be helpful for debugging purposes...
- In general, any consecutive string of \r and \n (in any order) will be
  treated as one SINGLE line break, except within an enclosed context
- The first 4 rows can be arbitrarily long
  - The first cell of first row is used to store this block of instruction
    text
  - The first 3 cells of the fourth row is used as headers
  - All other cells in the first and fourth rows are ignored
  - Columns in the second row alternate between property and value (ex.
    ' foo | 1 | bar | 3.5 | ... '
    - Any whitespaces before and after the property name are ignored
  - Columns in the third row are exclusively comments for properties in the
    second row
- Every following line can include any number of cells, but only the
  first three will be parsed (you can use the rest as comments if needed)
- The file must end in a sequence of \r and \n's
- Every cell containing a ^, \r, or \n must be enclosed in ""
  - If a "" is encountered right after a non-enclosed separator, \r, or \n,
    then the parser is said to enter an ""enclosed context"", such context
    ends immediately when a non-escaped "" that is not followed by \r, \n,
    or a separator is encountered
  - "" within each cell should be escaped using another "" in front of it,
  - If a "" is encountered in a non-enclosed context, and it is not right
    after a separator, \r, or \n, then it is entirely ignored
  - If a non-escaped "" is encountered in an enclosed context...
    - If it is followed by a separator, \r, or \n, then it is considered
      the closing quote of the current context
    - Otherwise, it is ignored
  - If a separator, \r, or \n is encountered while in an enclosed context,
    it will be preserved
",
"IsValid"," ","NonDialogueFontScale"," ","DialogueFontScale"," ",
"Set to 1 allow the parser to read this file, otherwise it will be skipped and the default English localization will be used as fallback"," ","Float value that scales font size of all dialogue text, this is an option separate because the English font of this game is *really* tiny, like about 1/3 of regular font when under the same font size."," ","Float value that scales font size of all dialogue text, this is an option separate because the English font of this game is *really* tiny, like about 1/3 of regular font when under the same font size. Recommended setting is around 0.3~0.6."," ",
"Path","Orig","Translation",
"Map/EightPuzzle/MountainSTile (1)/Objects/Rock Column/Frozen Guy@0:0","S-s-s-s-so... c-cold...","_ho_S-s-s-s-so... c-cold_ho_",
"Map/EightPuzzle/MountainSTile (1)/Objects/Rock Column/Frozen Guy@1:0","Th-thanks for thawing me out.","_yar_Th-thanks for thawin_yar_",
"Map/EightPuzzle/MountainSTile (1)/Objects/Rock Column/Frozen Guy@2:0","I wish there was lava in that b-bucket to keep me warm.","_yar_I wish there was lav_yar_",
"Map/EightPuzzle/MountainSTile (1)/Objects/Rock Column/Frozen Guy@2:1","If you could pour a whole lavafall into that bucket, I'd never be c-cold again!","_yar_If you could pour a _yar_",
"Map/EightPuzzle/MountainSTile (1)/Objects/Rock Column/Frozen Guy@2:2","Fingers... g-g-getting co-cold.","_ho_Fingers... g-g-getti_ho_",
"Map/EightPuzzle/MountainSTile (1)/Objects/Rock Column/Frozen Guy@3:0","Ah that feels good... but it won't last like this. N-need the lava in the bucket.","_yar_Ah that feels good.._yar_",
"Map/EightPuzzle/MountainSTile (1)/Objects/Rock Column/Frozen Guy@4:0","I can f-f-feel my hands again!","_yar_I can f-f-feel my ha_yar_",
"Map/EightPuzzle/MountainSTile (1)/Objects/Rock Column/Frozen Guy@4:1","Take this key to the basement, I'm sure there's s-so-some-thing cool in there.","_ho_Take this key to the_ho_",
"Map/EightPuzzle/MountainSTile (1)/Objects/Rock Column/Frozen Guy@5:0","Now h-h-ho-how do I get down from here.","_yar_Now h-h-ho-how do I _yar_",
"Map/EightPuzzle/MountainSTile (1)/Objects/Rock Column/Frozen Guy@6:0","Ug-g-g-g-ghh it's so c-c-old here...","_arrr_Ug-g-g-g-ghh it's so_arrr_",
"Map/EightPuzzle/MountainSTile (1)/Objects/Rock Column/Frozen Guy@6:1","Is he ready-ddy yet?","_ho_Is he ready-ddy yet?_ho_",
"Map/EightPuzzle/MountainSTile (1)/Objects/Rock Column/Frozen Guy@7:0","W-w-woah! It fell through!","_arrr_W-w-woah! It fell th_arrr_",
"Map/EightPuzzle/MountainSTile (1)/Objects/Rock Column/Frozen Guy@7:1","Looks li-like the c-cart stayed safe too.","_ho_Looks li-like the c-_ho_",
"Map/EightPuzzle/MountainSTile (1)/Objects/Rock Column/Frozen Guy@8:0","S-s-so... w-warm...","_yar_S-s-so... w-warm..._yar_",
"Map/EightPuzzle/MountainSTile (2)/Objects/Basement Dude@0:0","Oi, I've been breaking me back breaking these crates...","_ho_Oi, I've been breaki_ho_",
"Map/EightPuzzle/MountainSTile (2)/Objects/Basement Dude@0:1","The last rock I threw broke. Ye don't have anything else to break crates do ye?","_ho_The last rock I thre_ho_",
"Map/EightPuzzle/MountainSTile (2)/Objects/Basement Dude@1:0","That was a smashingly good idea!","_ho_That was a smashingl_ho_",
"Map/EightPuzzle/MountainSTile (2)/Objects/Basement Dude@1:1","Oh. Door's still locked, huh. Can't smash that...","_yar_Oh. Door's still loc_yar_",
"Map/EightPuzzle/MountainSTile (2)/Objects/Basement Dude@1:2","I reckon someone 'round here should have that key.","_yar_I reckon someone 'ro_yar_",
"Map/EightPuzzle/MountainSTile (2)/Objects/Basement Dude@10:0","Finally! A 
warm drink.","_yar_Finally! A 
warm dri_yar_",
"Map/EightPuzzle/MountainSTile (2)/Objects/Basement Dude@2:0","Ye found the key!","_yar_Ye found the key!_yar_",
"Map/EightPuzzle/MountainSTile (2)/Objects/Basement Dude@2:1","Still need something to break that crate though. Some kinda... large... heavy object.","_ho_Still need something_ho_",
"Map/EightPuzzle/MountainSTile (2)/Objects/Basement Dude@2:2","Some kinda large, heavy, metal, throwable object.","_yar_Some kinda large, he_yar_",
"Map/EightPuzzle/MountainSTile (2)/Objects/Basement Dude@2:3","To be quite frank, I reckon some sorta anchor would do wonders.","_yar_To be quite frank, I_yar_",
"Map/EightPuzzle/MountainSTile (2)/Objects/Basement Dude@2:4","I used to break crates with anchors all the time back in my swashbuckling days.","_yar_I used to break crat_yar_",
"Map/EightPuzzle/MountainSTile (2)/Objects/Basement Dude@2:5","They worked wonders, waaayyyy better than all the other large, heavy, metal throwable objects we had.","_yar_They worked wonders,_yar_",
"Map/EightPuzzle/MountainSTile (2)/Objects/Basement Dude@3:0","Alroight, now we're in buisness. ","_yar_Alroight, now we're _yar_",
"Map/EightPuzzle/MountainSTile (2)/Objects/Basement Dude@4:0","Oi, where are you taking that?","_arrr_Oi, where are you ta_arrr_",
"Map/EightPuzzle/MountainSTile (2)/Objects/Basement Dude@5:0","Work sure is hard.","_yar_Work sure is hard._yar_",
"Map/EightPuzzle/MountainSTile (2)/Objects/Basement Dude@5:1","I could really go for a hot cocoa.","_yar_I could really go fo_yar_",
"Map/EightPuzzle/MountainSTile (2)/Objects/Basement Dude@6:0","I've got an idea cooking up to help that researcher chap.","_arrr_I've got an idea coo_arrr_",
"Map/EightPuzzle/MountainSTile (2)/Objects/Basement Dude@6:1","Get the trolley unstuck from the rocks first though, alroight?","_yar_Get the trolley unst_yar_",
"Map/EightPuzzle/MountainSTile (2)/Objects/Basement Dude@7:0","Alroight, last thing.","_arrr_Alroight, last thing_arrr_",
"Map/EightPuzzle/MountainSTile (2)/Objects/Basement Dude@7:1","My mate's on the tile with all the pine tree on it.","_ho_My mate's on the til_ho_",
"Map/EightPuzzle/MountainSTile (2)/Objects/Basement Dude@7:2","Put that one underneath this tile.","_ho_Put that one underne_ho_",
"Map/EightPuzzle/MountainSTile (2)/Objects/Basement Dude@8:0","Alroight, let's try out this tech.","_arrr_Alroight, let's try _arrr_",
"Map/EightPuzzle/MountainSTile (2)/Objects/Basement Dude@8:1","Drop the trolley on these tracks here and...","_arrr_Drop the trolley on _arrr_",
"Map/EightPuzzle/MountainSTile (2)/Objects/Basement Dude@8:2","Give the ice a nice smash with your Anchor!","_arrr_Give the ice a nice _arrr_",
"Map/EightPuzzle/MountainSTile (2)/Objects/Basement Dude@9:0","Smashing! My mate downstairs radio'd me it worked.","_arrr_Smashing! My mate do_arrr_",
"Map/EightPuzzle/MountainSTile (2)/Objects/Basement Dude@9:1","Boss spent all that time on the two-way elevator, but now...","_arrr_Boss spent all that _arrr_",
"Map/EightPuzzle/MountainSTile (2)/Objects/Basement Dude@9:2","Our transit cycles will be faster than ever dropping through the ice!","_arrr_Our transit cycles w_arrr_",
"Map/EightPuzzle/MountainSTile (2)/Objects/Basement Dude@9:3","She'll be over the moon when she hears about this.","_ho_She'll be over the m_ho_",
"Map/EightPuzzle/MountainSTile (3)/Objects/Heater Worker@0:0","yoooo dude.","_yar_yoooo dude._yar_",
"Map/EightPuzzle/MountainSTile (3)/Objects/Heater Worker@0:1","that pipe supplying the heater with lava is broken. sooo lame.","_arrr_that pipe supplying _arrr_",
"Map/EightPuzzle/MountainSTile (3)/Objects/Heater Worker@0:2","my boss had a fix but she's totally vanished bro. ","_ho_my boss had a fix bu_ho_",
"Map/EightPuzzle/MountainSTile (3)/Objects/Heater Worker@1:0","wooow you got the thing spining with no heater? niiiice.","_arrr_wooow you got the th_arrr_",
"Map/EightPuzzle/MountainSTile (3)/Objects/Heater Worker@10:0","duuuuude thanks for fixing the world and stuff.","_yar_duuuuude thanks for _yar_",
"Map/EightPuzzle/MountainSTile (3)/Objects/Heater Worker@2:0","we reaaaaally gotta find my boss so we can fix this pipe.","_ho_we reaaaaally gotta _ho_",
"Map/EightPuzzle/MountainSTile (3)/Objects/Heater Worker@3:0","a scientist? crystals? dude what do all those words mean i just watch this pipe here.","_ho_a scientist? crystal_ho_",
"Map/EightPuzzle/MountainSTile (3)/Objects/Heater Worker@4:0","oh heeeey you found the boss lady. good work dude.","_yar_oh heeeey you found _yar_",
"Map/EightPuzzle/MountainSTile (3)/Objects/Heater Worker@4:1","she give us the pipe? brooo you gotta be a better negotiator.","_arrr_she give us the pipe_arrr_",
"Map/EightPuzzle/MountainSTile (3)/Objects/Heater Worker@4:2","you gotta get that pipe my guy or the heater will be broken foreeeeever","_yar_you gotta get that p_yar_",
"Map/EightPuzzle/MountainSTile (3)/Objects/Heater Worker@5:0","yooooo you found the pipe.","_arrr_yooooo you found the_arrr_",
"Map/EightPuzzle/MountainSTile (3)/Objects/Heater Worker@5:1","put it in bro.","_arrr_put it in bro._arrr_",
"Map/EightPuzzle/MountainSTile (3)/Objects/Heater Worker@6:0","niceeee now we need two cartfuls of lava... but theres something important-","_arrr_niceeee now we need _arrr_",
"Map/EightPuzzle/MountainSTile (3)/Objects/Heater Worker@6:1","the minecart cant stop moving while its being delivered. otherwise the tank will be emptied.","_yar_the minecart cant st_yar_",
"Map/EightPuzzle/MountainSTile (3)/Objects/Heater Worker@6:2","dont ask why, thats just how it works my guy.","_ho_dont ask why, thats _ho_",
"Map/EightPuzzle/MountainSTile (3)/Objects/Heater Worker@7:0","one more bucket. dont let that cart stop.","_ho_one more bucket. don_ho_",
"Map/EightPuzzle/MountainSTile (3)/Objects/Heater Worker@8:0","you did it my dude. ","_ho_you did it my dude. _ho_",
"Map/EightPuzzle/MountainSTile (3)/Objects/Heater Worker@8:1","maybe you should be the one who watches the heater.","_yar_maybe you should be _yar_",
"Map/EightPuzzle/MountainSTile (3)/Objects/Heater Worker@9:0","go enjoy making that goooooo. or whatever they do there. ","_arrr_go enjoy making that_arrr_",
"Map/EightPuzzle/MountainSTile (3)/Objects/Waterwheel Worker@0:0","My waterwheel is central to the Crystal Mines! But she's seen better days...","_arrr_My waterwheel is cen_arrr_",
"Map/EightPuzzle/MountainSTile (3)/Objects/Waterwheel Worker@0:1","Some MRI researcher's coming and she said she needed LOTS of power, so we gotta get fixing.","_ho_Some MRI researcher'_ho_",
"Map/EightPuzzle/MountainSTile (3)/Objects/Waterwheel Worker@0:2","She needs flowing water, fixed unfrozen gears, and the heater is a whole later issue.","_yar_She needs flowing wa_yar_",
"Map/EightPuzzle/MountainSTile (3)/Objects/Waterwheel Worker@0:3","First things first...","_arrr_First things first.._arrr_",
"Map/EightPuzzle/MountainSTile (3)/Objects/Waterwheel Worker@0:4","...","_arrr_..._arrr_",
"Map/EightPuzzle/MountainSTile (3)/Objects/Waterwheel Worker@1:0","The waterwheel won't work without any <wavy>flowing</wavy> water!","_arrr_The waterwheel won't_arrr_",
"Map/EightPuzzle/MountainSTile (3)/Objects/Waterwheel Worker@10:0","Golly, my baby can keep her gears turning forever now.","_arrr_Golly, my baby can k_arrr_",
"Map/EightPuzzle/MountainSTile (3)/Objects/Waterwheel Worker@11:0","Bada-Bing! Nice and warm!","_arrr_Bada-Bing! Nice and _arrr_",
"Map/EightPuzzle/MountainSTile (3)/Objects/Waterwheel Worker@2:0","Gah! It looks like some of the gears of the power generation mechanism have frozen over.","_ho_Gah! It looks like s_ho_",
"Map/EightPuzzle/MountainSTile (3)/Objects/Waterwheel Worker@2:1","Think you can do it?","_yar_Think you can do it?_yar_",
"Map/EightPuzzle/MountainSTile (3)/Objects/Waterwheel Worker@2:2","This waterwheel is central to these mines. We'll need the gears and heater to work eventually.","_ho_This waterwheel is c_ho_",
"Map/EightPuzzle/MountainSTile (3)/Objects/Waterwheel Worker@3:0","The gears are unfrozen, now we just need the river current again.","_arrr_The gears are unfroz_arrr_",
"Map/EightPuzzle/MountainSTile (3)/Objects/Waterwheel Worker@4:0","Egads! You got the gears unfrozen.","_yar_Egads! You got the g_yar_",
"Map/EightPuzzle/MountainSTile (3)/Objects/Waterwheel Worker@4:1","But it looks like they're still stuck. Looks like there's a couple of screws loose.","_arrr_But it looks like th_arrr_",
"Map/EightPuzzle/MountainSTile (3)/Objects/Waterwheel Worker@4:2","My boss had some tools to fix this but dunno where she went.","_yar_My boss had some too_yar_",
"Map/EightPuzzle/MountainSTile (3)/Objects/Waterwheel Worker@4:3","Maybe the craftsman downstairs has some tools. Heard he drives a hard bargin though.","_ho_Maybe the craftsman _ho_",
"Map/EightPuzzle/MountainSTile (3)/Objects/Waterwheel Worker@5:0","Nice! Let's fix these gears - aaaaaaand, done!","_yar_Nice! Let's fix thes_yar_",
"Map/EightPuzzle/MountainSTile (3)/Objects/Waterwheel Worker@6:0","Whew! Now let's get those gears unfrozen again!","_ho_Whew! Now let's get _ho_",
"Map/EightPuzzle/MountainSTile (3)/Objects/Waterwheel Worker@7:0","Eep! You got the wheel turning again!","_ho_Eep! You got the whe_ho_",
"Map/EightPuzzle/MountainSTile (3)/Objects/Waterwheel Worker@8:0","Zoinks! We should really look into a more permanent heating solution, eh?","_yar_Zoinks! We should re_yar_",
"Map/EightPuzzle/MountainSTile (3)/Objects/Waterwheel Worker@8:1","Some researcher from MRI is here to study the crystals we've been digging up.","_ho_Some researcher from_ho_",
"Map/EightPuzzle/MountainSTile (3)/Objects/Waterwheel Worker@8:2","They're trying to tap into their power to make a new generation of rocket fuel. Isn't that awesome?!","_arrr_They're trying to ta_arrr_",
"Map/EightPuzzle/MountainSTile (3)/Objects/Waterwheel Worker@8:3","Anyway, this pipe needs fixing if the waterwheel's gonna be permanently running.","_ho_Anyway, this pipe ne_ho_",
"Map/EightPuzzle/MountainSTile (3)/Objects/Waterwheel Worker@9:0","Boo-yah! You found my boss!","_ho_Boo-yah! You found m_ho_",
"Map/EightPuzzle/MountainSTile (3)/Objects/Waterwheel Worker@9:1","She should be able to help us fix that pipe.","_yar_She should be able t_yar_",
"Map/EightPuzzle/MountainSTile (4)/Objects/Sara@0:0","Hey! Do you work here? I'm Sara, here to investigate these crystals!","_arrr_Hey! Do you work her_arrr_",
"Map/EightPuzzle/MountainSTile (4)/Objects/Sara@0:1","I've been trying to use these crystal extractors and processors but...","_ho_I've been trying to _ho_",
"Map/EightPuzzle/MountainSTile (4)/Objects/Sara@0:2","There's no power!","_ho_There's no power!_ho_",
"Map/EightPuzzle/MountainSTile (4)/Objects/Sara@0:3","And no crystals!!","_arrr_And no crystals!!_arrr_",
"Map/EightPuzzle/MountainSTile (4)/Objects/Sara@0:4","There should be a minecart for the crystals, and that waterwheel should give us some power.","_arrr_There should be a mi_arrr_",
"Map/EightPuzzle/MountainSTile (4)/Objects/Sara@1:0","You hotwired the generator? You're a helluva engineer!","_ho_You hotwired the gen_ho_",
"Map/EightPuzzle/MountainSTile (4)/Objects/Sara@1:1","Now lets get this extractor loaded up with some crystals. Use the minecart!","_ho_Now lets get this ex_ho_",
"Map/EightPuzzle/MountainSTile (4)/Objects/Sara@10:0","Let's make some goo!","_arrr_Let's make some goo!_arrr_",
"Map/EightPuzzle/MountainSTile (4)/Objects/Sara@10:1","I'll need 2 crystals to create the specimen.","_arrr_I'll need 2 crystals_arrr_",
"Map/EightPuzzle/MountainSTile (4)/Objects/Sara@10:2","Be careful, though. Moving the machine will also dissolve the crystals.","_yar_Be careful, though. _yar_",
"Map/EightPuzzle/MountainSTile (4)/Objects/Sara@10:3","And also... the minecart has to be constantly moving when delivering, or it will reset! Because science!!","_arrr_And also... the mine_arrr_",
"Map/EightPuzzle/MountainSTile (4)/Objects/Sara@11:0","One crystal down, one more to go!","_yar_One crystal down, on_yar_",
"Map/EightPuzzle/MountainSTile (4)/Objects/Sara@12:0","That's 2 crystals. Years of research all boils down to this moment.","_yar_That's 2 crystals. Y_yar_",
"Map/EightPuzzle/MountainSTile (4)/Objects/Sara@12:1","It works! It actually works!","_yar_It works! It actuall_yar_",
"Map/EightPuzzle/MountainSTile (4)/Objects/Sara@12:2","Oh look at all this wonderful, gemmy goo.","_arrr_Oh look at all this _arrr_",
"Map/EightPuzzle/MountainSTile (4)/Objects/Sara@13:0","I never thought this day would come. You've been a wonderful research partner.","_ho_I never thought this_ho_",
"Map/EightPuzzle/MountainSTile (4)/Objects/Sara@14:0","Wait until the folks back at the MRI hear about this. The rocket program is saved!","_yar_Wait until the folks_yar_",
"Map/EightPuzzle/MountainSTile (4)/Objects/Sara@2:0","We got the crystals! Now let's get the processor powered.","_yar_We got the crystals!_yar_",
"Map/EightPuzzle/MountainSTile (4)/Objects/Sara@3:0","Alright the processor is all ready to go! This should make some good goop.","_ho_Alright the processo_ho_",
"Map/EightPuzzle/MountainSTile (4)/Objects/Sara@4:0","Power: check. Crystal: check.","_yar_Power: check. Crysta_yar_",
"Map/EightPuzzle/MountainSTile (4)/Objects/Sara@4:1","Let's do this!","_ho_Let's do this!_ho_",
"Map/EightPuzzle/MountainSTile (4)/Objects/Sara@5:0","Oh no ohhhh nooooo...","_ho_Oh no ohhhh nooooo.._ho_",
"Map/EightPuzzle/MountainSTile (4)/Objects/Sara@5:1","This... this was not in the manual.","_arrr_This... this was not_arrr_",
"Map/EightPuzzle/MountainSTile (4)/Objects/Sara@5:2","Hmm... looks like we're gonna need a replacement tank. Can you get that fixed real quick?","_ho_Hmm... looks like we_ho_",
"Map/EightPuzzle/MountainSTile (4)/Objects/Sara@6:0","You found one!","_yar_You found one!_yar_",
"Map/EightPuzzle/MountainSTile (4)/Objects/Sara@7:0","We've got the power!","_arrr_We've got the power!_arrr_",
"Map/EightPuzzle/MountainSTile (4)/Objects/Sara@7:1","But we still need to replace that extraction tank.","_ho_But we still need to_ho_",
"Map/EightPuzzle/MountainSTile (4)/Objects/Sara@7:2","According to my records, some Burt fella made the original one.","_arrr_According to my reco_arrr_",
"Map/EightPuzzle/MountainSTile (4)/Objects/Sara@8:0","Heh, good work.","_yar_Heh, good work._yar_",
"Map/EightPuzzle/MountainSTile (4)/Objects/Sara@8:1","As nervous as I am, we still need to power the extractor to make that goo.","_yar_As nervous as I am, _yar_",
"Map/EightPuzzle/MountainSTile (4)/Objects/Sara@8:2","Hopefully some power of the less *explosive* variety. ","_yar_Hopefully some power_yar_",
"Map/EightPuzzle/MountainSTile (4)/Objects/Sara@9:0","We've got power! Now let's hope this thing stays stable.","_ho_We've got power! Now_ho_",
"Map/EightPuzzle/MountainSTile (4)/Objects/Thin Ice Sign@0:0","DANGER: Thin ice. 
No heavy objects.","_yar_DANGER: Thin ice. 
N_yar_",
"Map/EightPuzzle/MountainSTile (6)/Objects/Elevator Builder@0:0","*Sob* they dont *sob* understand","_ho_*Sob* they dont *sob_ho_",
"Map/EightPuzzle/MountainSTile (6)/Objects/Elevator Builder@0:1","i built that elevator over there... fine piece of work, isnt she?","_arrr_i built that elevato_arrr_",
"Map/EightPuzzle/MountainSTile (6)/Objects/Elevator Builder@0:2","but, i made it go up... AND down... but they only ever *sob* use it to go up!","_arrr_but, i made it go up_arrr_",
"Map/EightPuzzle/MountainSTile (6)/Objects/Elevator Builder@0:3","""just drop it through the holes"" they say... *sob*","_yar_""just drop it throu_yar_",
"Map/EightPuzzle/MountainSTile (6)/Objects/Elevator Builder@0:4","i cant stand to see my efforts wasted... i cant work like this...","_ho_i cant stand to see _ho_",
"Map/EightPuzzle/MountainSTile (6)/Objects/Elevator Builder@0:5","i just *sob* want to see the elevator go *sob* down","_arrr_i just *sob* want to_arrr_",
"Map/EightPuzzle/MountainSTile (6)/Objects/Elevator Builder@1:0","*Sob* when will... wait a second","_arrr_*Sob* when will... w_arrr_",
"Map/EightPuzzle/MountainSTile (6)/Objects/Elevator Builder@1:1","You did it! You *sob* actually did it!","_arrr_You did it! You *sob_arrr_",
"Map/EightPuzzle/MountainSTile (6)/Objects/Elevator Builder@1:2","I'm not a failure after all!","_yar_I'm not a failure af_yar_",
"Map/EightPuzzle/MountainSTile (6)/Objects/Elevator Builder@1:3","Thank you for demonstrating true bravery.","_yar_Thank you for demons_yar_",
"Map/EightPuzzle/MountainSTile (6)/Objects/Elevator Builder@1:4","Now let's keep inventing!","_yar_Now let's keep inven_yar_",
"Map/EightPuzzle/MountainSTile (6)/Objects/Elevator Builder@2:0","Oh how they treasure my creations, it brings a tear to my eye. *sob* ","_yar_Oh how they treasure_yar_",
"Map/EightPuzzle/MountainSTile (6)/Objects/Elevator Builder@3:0","were so close to *sob* having everything fixed, but all the rails are jumbled","_ho_were so close to *so_ho_",
"Map/EightPuzzle/MountainSTile (6)/Objects/Elevator Builder@4:0","You *sob* did it! The Crystal Mines are functional again!","_arrr_You *sob* did it! Th_arrr_",
"Map/EightPuzzle/MountainSTile (6)/Objects/Elevator Builder@4:1","You're from the factory right? Tell them everything is working on our end!","_arrr_You're from the fact_arrr_",
"Map/EightPuzzle/MountainSTile (8)/Objects/Train Station/Juliet@0:0","My love, what a wonderful honeymoon this has been!","_yar_My love, what a wond_yar_",
"Map/EightPuzzle/MountainSTile (8)/Objects/Train Station/Romeo@0:0","Only the best for you, my love!","_ho_Only the best for yo_ho_",
"Map/EightPuzzle/MountainSTile (8)/Objects/Train Station/Romeo@0:1","Though I dare not think about our descent from these heights...","_yar_Though I dare not th_yar_",
"Map/World Grid/Cave MC Entrance/Bomb Sign@0:0","DANGER: Explosives.","_arrr_DANGER: Explosives._arrr_",
"Map/World Grid/Cave MC Entrance/Rocco@0:0","Our crystal transport cart got trapped in the tunnel collapse.","_ho_Our crystal transpor_ho_",
"Map/World Grid/Cave MC Entrance/Rocco@0:1","But you know what they say: any problem can be fixed with explosives!","_arrr_But you know what th_arrr_",
"Map/World Grid/Cave MC Entrance/Rocco@0:2","But I don't have anything to ignite them... so nothing for now.","_yar_But I don't have any_yar_",
"Map/World Grid/Cave MC Entrance/Rocco@1:0","Haven't found anything to light these explosives, have you?","_ho_Haven't found anythi_ho_",
"Map/World Grid/Cave MC Entrance/Rocco@1:1","I'm getting antsy over here.","_yar_I'm getting antsy ov_yar_",
"Map/World Grid/Cave MC Entrance/Rocco@2:0","Okay, this is probably not safe but...","_arrr_Okay, this is probab_arrr_",
"Map/World Grid/Cave MC Entrance/Rocco@2:1","Promise not to tell anyone?","_ho_Promise not to tell _ho_",
"Map/World Grid/Cave MC Entrance/Rocco@3:0","BOOM! BOOM!! BOOM!!! BOOM!!!!","_yar_BOOM! BOOM!! BOOM!!!_yar_",
"Map/World Grid/Cave MC Entrance/Rocco@3:1","I mean uh... thanks for clearing that up. ","_ho_I mean uh... thanks _ho_",
"Map/World Grid/Cave MC Entrance/Rocco@4:0","Drop the minecart on these powered rails to give her a little boost.","_ho_Drop the minecart on_ho_",
"Map/World Grid/Cave MC Entrance/Rocco@5:0","Wow, look at her go!","_ho_Wow, look at her go!_ho_",
"Map/World Grid/Cave MC Entrance/Rocco@6:0","All in a days work.","_ho_All in a days work._ho_",
"Map/World Grid/Cave MC Entrance/Rocco@7:0","Mmmm 
sustinance.","_ho_Mmmm 
sustinance._ho_",
"Map/World Grid/Crystal Mine/Crystal Danger Sign@0:0","DANGER: Unstable crystals. Avoid large, sudden movements.","_yar_DANGER: Unstable cry_yar_",
"Map/World Grid/Crystal Mine/Crystal Miner@0:0","Welcome to The Crystal Loop!","_arrr_Welcome to The Cryst_arrr_",
"Map/World Grid/Crystal Mine/Crystal Miner@0:1","Whaaaaaat? You don't have a minecart?","_ho_Whaaaaaat? You don't_ho_",
"Map/World Grid/Crystal Mine/Crystal Miner@0:2","I'm sorry. These things are too heavy to be moved by hand.","_yar_I'm sorry. These thi_yar_",
"Map/World Grid/Crystal Mine/Crystal Miner@1:0","Now you be careful with those raw crystals.","_yar_Now you be careful w_yar_",
"Map/World Grid/Crystal Mine/Crystal Miner@1:1","They're super unstable. Any magical interference will destroy them!","_yar_They're super unstab_yar_",
"Map/World Grid/Crystal Mine/Crystal Miner@1:2","You seen all this world-moving nonsense happening lately? Don't do that.","_yar_You seen all this wo_yar_",
